{
  "schemaVersion": 1,
  "sourceRevision": "d2accc4a79b6bcf2708213c97093ab5ba6c06381",
  "runtime": ".NET 10.0.12",
  "systemTextJson": "10.0.12\u002B95017c711e6afc1085133d440e42b4bd78155701",
  "profile": "CamelCase/default encoder/compact; ComplexKey, EnumerableConceptAs, ConceptAs factories; not Globals",
  "globalStubAccesses": 0,
  "count": 151,
  "factoryAdmission": [
    {
      "type": "System.Collections.Generic.Dictionary\u00602[System.String,System.Int32]",
      "admitted": false
    },
    {
      "type": "System.Collections.Generic.Dictionary\u00602[System.Guid,System.Int32]",
      "admitted": false
    },
    {
      "type": "System.Collections.Generic.Dictionary\u00602[System.Int32,System.Int32]",
      "admitted": false
    },
    {
      "type": "System.Collections.Generic.Dictionary\u00602[System.Decimal,System.Int32]",
      "admitted": false
    },
    {
      "type": "System.Collections.Generic.Dictionary\u00602[System.Uri,System.Int32]",
      "admitted": false
    },
    {
      "type": "System.Collections.Generic.Dictionary\u00602[System.DateTime,System.Int32]",
      "admitted": false
    },
    {
      "type": "System.Collections.Generic.Dictionary\u00602[TextKey,System.Int32]",
      "admitted": true
    },
    {
      "type": "System.Collections.Generic.IDictionary\u00602[TextKey,System.Int32]",
      "admitted": true
    },
    {
      "type": "System.Collections.Generic.IReadOnlyDictionary\u00602[TextKey,System.Int32]",
      "admitted": false
    },
    {
      "type": "System.Collections.Generic.Dictionary\u00602[Composite,System.Int32]",
      "admitted": true
    },
    {
      "type": "System.Collections.Hashtable",
      "admitted": false
    }
  ],
  "observations": [
    {
      "id": "string/missing",
      "kind": "string",
      "operation": "read",
      "origin": "authored-stimulus",
      "sourceCapture": "inputs.json",
      "sourceCaseId": "string/missing",
      "input": "{}",
      "read": {
        "stage": "read",
        "status": "accepted",
        "value": {
          "state": "map",
          "count": 0,
          "entries": []
        }
      },
      "rewrite": {
        "stage": "rewrite",
        "status": "accepted",
        "value": "{\u0022map\u0022:{}}"
      },
      "returnedObject": true
    },
    {
      "id": "string/null-map",
      "kind": "string",
      "operation": "read",
      "origin": "authored-stimulus",
      "sourceCapture": "inputs.json",
      "sourceCaseId": "string/null-map",
      "input": "{\u0022map\u0022:null}",
      "read": {
        "stage": "read",
        "status": "accepted",
        "value": {
          "state": "null"
        }
      },
      "rewrite": {
        "stage": "rewrite",
        "status": "accepted",
        "value": "{\u0022map\u0022:null}"
      },
      "returnedObject": true
    },
    {
      "id": "string/empty-map",
      "kind": "string",
      "operation": "read",
      "origin": "authored-stimulus",
      "sourceCapture": "inputs.json",
      "sourceCaseId": "string/empty-map",
      "input": "{\u0022map\u0022:{}}",
      "read": {
        "stage": "read",
        "status": "accepted",
        "value": {
          "state": "map",
          "count": 0,
          "entries": []
        }
      },
      "rewrite": {
        "stage": "rewrite",
        "status": "accepted",
        "value": "{\u0022map\u0022:{}}"
      },
      "returnedObject": true
    },
    {
      "id": "string/array-map",
      "kind": "string",
      "operation": "read",
      "origin": "authored-stimulus",
      "sourceCapture": "inputs.json",
      "sourceCaseId": "string/array-map",
      "input": "{\u0022map\u0022:[]}",
      "read": {
        "stage": "read",
        "status": "rejected",
        "exception": "System.Text.Json.JsonException",
        "innerException": null,
        "message": "The JSON value could not be converted to System.Collections.Generic.IDictionary\u00602[System.String,System.Int32]. Path: $.map | LineNumber: 0 | BytePositionInLine: 8."
      },
      "rewrite": {
        "stage": "rewrite",
        "status": "not-attempted",
        "reason": "no-returned-object"
      },
      "returnedObject": false
    },
    {
      "id": "string/populated-array-map",
      "kind": "string",
      "operation": "read",
      "origin": "authored-stimulus",
      "sourceCapture": "inputs.json",
      "sourceCaseId": "string/populated-array-map",
      "input": "{\u0022map\u0022:[1]}",
      "read": {
        "stage": "read",
        "status": "rejected",
        "exception": "System.Text.Json.JsonException",
        "innerException": null,
        "message": "The JSON value could not be converted to System.Collections.Generic.IDictionary\u00602[System.String,System.Int32]. Path: $.map | LineNumber: 0 | BytePositionInLine: 8."
      },
      "rewrite": {
        "stage": "rewrite",
        "status": "not-attempted",
        "reason": "no-returned-object"
      },
      "returnedObject": false
    },
    {
      "id": "string/number-map",
      "kind": "string",
      "operation": "read",
      "origin": "authored-stimulus",
      "sourceCapture": "inputs.json",
      "sourceCaseId": "string/number-map",
      "input": "{\u0022map\u0022:7}",
      "read": {
        "stage": "read",
        "status": "rejected",
        "exception": "System.Text.Json.JsonException",
        "innerException": null,
        "message": "The JSON value could not be converted to System.Collections.Generic.IDictionary\u00602[System.String,System.Int32]. Path: $.map | LineNumber: 0 | BytePositionInLine: 8."
      },
      "rewrite": {
        "stage": "rewrite",
        "status": "not-attempted",
        "reason": "no-returned-object"
      },
      "returnedObject": false
    },
    {
      "id": "string/zero-map",
      "kind": "string",
      "operation": "read",
      "origin": "authored-stimulus",
      "sourceCapture": "inputs.json",
      "sourceCaseId": "string/zero-map",
      "input": "{\u0022map\u0022:0}",
      "read": {
        "stage": "read",
        "status": "rejected",
        "exception": "System.Text.Json.JsonException",
        "innerException": null,
        "message": "The JSON value could not be converted to System.Collections.Generic.IDictionary\u00602[System.String,System.Int32]. Path: $.map | LineNumber: 0 | BytePositionInLine: 8."
      },
      "rewrite": {
        "stage": "rewrite",
        "status": "not-attempted",
        "reason": "no-returned-object"
      },
      "returnedObject": false
    },
    {
      "id": "string/false-map",
      "kind": "string",
      "operation": "read",
      "origin": "authored-stimulus",
      "sourceCapture": "inputs.json",
      "sourceCaseId": "string/false-map",
      "input": "{\u0022map\u0022:false}",
      "read": {
        "stage": "read",
        "status": "rejected",
        "exception": "System.Text.Json.JsonException",
        "innerException": null,
        "message": "The JSON value could not be converted to System.Collections.Generic.IDictionary\u00602[System.String,System.Int32]. Path: $.map | LineNumber: 0 | BytePositionInLine: 12."
      },
      "rewrite": {
        "stage": "rewrite",
        "status": "not-attempted",
        "reason": "no-returned-object"
      },
      "returnedObject": false
    },
    {
      "id": "string/string-map",
      "kind": "string",
      "operation": "read",
      "origin": "authored-stimulus",
      "sourceCapture": "inputs.json",
      "sourceCaseId": "string/string-map",
      "input": "{\u0022map\u0022:\u0022ab\u0022}",
      "read": {
        "stage": "read",
        "status": "rejected",
        "exception": "System.Text.Json.JsonException",
        "innerException": null,
        "message": "The JSON value could not be converted to System.Collections.Generic.IDictionary\u00602[System.String,System.Int32]. Path: $.map | LineNumber: 0 | BytePositionInLine: 11."
      },
      "rewrite": {
        "stage": "rewrite",
        "status": "not-attempted",
        "reason": "no-returned-object"
      },
      "returnedObject": false
    },
    {
      "id": "string/malformed-outer",
      "kind": "string",
      "operation": "read",
      "origin": "authored-stimulus",
      "sourceCapture": "inputs.json",
      "sourceCaseId": "string/malformed-outer",
      "input": "{\u0022map\u0022:{",
      "read": {
        "stage": "read",
        "status": "rejected",
        "exception": "System.Text.Json.JsonException",
        "innerException": "System.Text.Json.JsonReaderException",
        "message": "Expected depth to be zero at the end of the JSON payload. There is an open JSON object or array that should be closed. Path: $.map | LineNumber: 0 | BytePositionInLine: 8."
      },
      "rewrite": {
        "stage": "rewrite",
        "status": "not-attempted",
        "reason": "no-returned-object"
      },
      "returnedObject": false
    },
    {
      "id": "string/null-envelope",
      "kind": "string",
      "operation": "read",
      "origin": "authored-stimulus",
      "sourceCapture": "inputs.json",
      "sourceCaseId": "string/null-envelope",
      "input": "null",
      "read": {
        "stage": "read",
        "status": "accepted",
        "value": {
          "envelope": "null"
        }
      },
      "rewrite": {
        "stage": "rewrite",
        "status": "not-attempted",
        "reason": "no-returned-object"
      },
      "returnedObject": false
    },
    {
      "id": "string/ordinary",
      "kind": "string",
      "operation": "read",
      "origin": "authored-stimulus",
      "sourceCapture": "inputs.json",
      "sourceCaseId": "string/ordinary",
      "input": "{\u0022map\u0022:{\u0022plain\u0022:42}}",
      "read": {
        "stage": "read",
        "status": "accepted",
        "value": {
          "state": "map",
          "count": 1,
          "entries": [
            {
              "key": "plain",
              "value": 42
            }
          ]
        }
      },